[
  {
    "name": "claude-desktop",
    "displayName": "Claude Desktop",
    "process": "/Applications/Claude.app/Contents/MacOS/Claude",
    "description": "Anthropic Claude desktop app"
  },
  {
    "name": "claude-code",
    "displayName": "Claude Code",
    "process": "~/.local/bin/claude",
    "description": "Anthropic Claude Code CLI"
  },
  {
    "name": "codex-desktop",
    "displayName": "Codex Desktop",
    "process": "/Applications/Codex.app/Contents/MacOS/Codex",
    "description": "OpenAI Codex desktop app"
  },
  {
    "name": "codex-cli",
    "displayName": "Codex CLI",
    "process": "~/.local/bin/codex",
    "description": "OpenAI Codex CLI"
  },
  {
    "name": "copilot-desktop",
    "displayName": "GitHub Copilot",
    "process": "/Applications/GitHub Copilot.app/Contents/MacOS/github",
    "description": "GitHub Copilot desktop coding agent"
  },
  {
    "name": "copilot-cli",
    "displayName": "GitHub Copilot CLI",
    "process": "~/.local/bin/copilot",
    "description": "GitHub Copilot coding agent CLI"
  },
  {
    "name": "cursor",
    "displayName": "Cursor",
    "process": "/Applications/Cursor.app/Contents/MacOS/Cursor",
    "description": "Cursor AI code editor"
  },
  {
    "name": "devin-desktop",
    "displayName": "Devin Desktop",
    "process": "/Applications/Devin.app/Contents/MacOS/Devin",
    "description": "Cognition Devin desktop app"
  },
  {
    "name": "devin-cli",
    "displayName": "Devin CLI",
    "process": "~/.local/bin/devin",
    "description": "Cognition Devin CLI"
  },
  {
    "name": "muse-cli",
    "displayName": "Muse CLI",
    "process": "~/.local/bin/muse",
    "description": "Meta Muse CLI"
  },
  {
    "name": "antigravity",
    "displayName": "Antigravity",
    "process": "/Applications/Antigravity.app/Contents/MacOS/Antigravity",
    "description": "Google Antigravity desktop app"
  },
  {
    "name": "antigravity-ide",
    "displayName": "Antigravity IDE",
    "process": "/Applications/Antigravity IDE.app/Contents/MacOS/Electron",
    "description": "Google Antigravity IDE"
  },
  {
    "name": "antigravity-cli",
    "displayName": "Antigravity CLI",
    "process": "~/.local/bin/agy",
    "description": "Google Antigravity CLI"
  },
  {
    "name": "cline-cli",
    "displayName": "Cline CLI",
    "process": "~/.local/bin/cline",
    "description": "Cline coding agent CLI"
  },
  {
    "name": "factory-droid",
    "displayName": "Factory Droid",
    "process": "~/.local/bin/droid",
    "description": "Factory Droid coding agent CLI"
  },
  {
    "name": "goose-cli",
    "displayName": "Goose CLI",
    "process": "~/.local/bin/goose",
    "description": "Block Goose model-independent coding agent"
  },
  {
    "name": "grok-build",
    "displayName": "Grok Build",
    "process": "~/.local/bin/grok",
    "description": "xAI Grok Build CLI"
  },
  {
    "name": "hermes-cli",
    "displayName": "Hermes Agent",
    "process": "~/.local/bin/hermes",
    "description": "Nous Research Hermes agent CLI"
  },
  {
    "name": "kiro",
    "displayName": "Kiro IDE",
    "process": "/Applications/Kiro.app/Contents/MacOS/Electron",
    "description": "AWS Kiro IDE"
  },
  {
    "name": "kiro-cli-desktop",
    "displayName": "Kiro CLI Desktop",
    "process": "/Applications/Kiro CLI.app/Contents/MacOS/kiro_cli_desktop",
    "description": "AWS Kiro CLI desktop host"
  },
  {
    "name": "kiro-cli",
    "displayName": "Kiro CLI",
    "process": "/Applications/Kiro CLI.app/Contents/MacOS/kiro-cli",
    "description": "AWS Kiro terminal CLI"
  },
  {
    "name": "kiro-cli-terminal",
    "displayName": "Kiro CLI Terminal",
    "process": "/Applications/Kiro CLI.app/Contents/MacOS/kiro-cli-term",
    "description": "AWS Kiro CLI terminal integration"
  },
  {
    "name": "kiro-cli-chat",
    "displayName": "Kiro CLI Chat",
    "process": "/Applications/Kiro CLI.app/Contents/MacOS/kiro-cli-chat",
    "description": "AWS Kiro CLI chat process"
  },
  {
    "name": "opencode-desktop",
    "displayName": "OpenCode Desktop",
    "process": "/Applications/OpenCode.app/Contents/MacOS/OpenCode",
    "description": "OpenCode desktop coding agent"
  },
  {
    "name": "opencode-desktop-cli",
    "displayName": "OpenCode Desktop Sidecar",
    "process": "/Applications/OpenCode.app/Contents/MacOS/opencode-cli",
    "description": "OpenCode desktop bundled agent sidecar"
  },
  {
    "name": "opencode-cli",
    "displayName": "OpenCode CLI",
    "process": "~/.local/bin/opencode",
    "description": "OpenCode model-independent CLI"
  },
  {
    "name": "pi-cli",
    "displayName": "Pi Coding Agent",
    "process": "~/.local/bin/pi",
    "description": "Pi terminal coding agent"
  },
  {
    "name": "warp",
    "displayName": "Warp Agent",
    "process": "/Applications/Warp.app/Contents/MacOS/stable",
    "description": "Warp terminal and local coding agent"
  },
  {
    "name": "amp-cli",
    "displayName": "Amp CLI",
    "process": "~/.local/bin/amp",
    "description": "Sourcegraph Amp coding agent CLI"
  },
  {
    "name": "aider-cli",
    "displayName": "Aider CLI",
    "process": "~/.local/bin/aider",
    "description": "Aider terminal coding agent"
  }
]
